Item, position_x, position_y, message, has_key, path
dresser, 200, 80, Someone needs to do their laundry!, False, Escape!/assets/images/dresser.png
plant, 100, 100, Just a pile of dead leaves here..., True, Escape!/assets/images/plant.png
sofa, 850, 140, Only spare change here!, False, Escape!/assets/images/sofa.png
cat, 800, 200, Leave me alone!, False, "Escape!/assets/images/cat.png"
dog, 900, 520, You found the key!, True, "Escape!/assets/images/dog.png"
computer, 650, 580, Someone's playing Minecraft!, False, "Escape!/assets/images/computer.png"
bookshelf, 50, 530, How to escape - For Dummies!, False, "Escape!/assets/images/bookshelf.png"
teddybear, 520, 340, So soft and cuddly!!, False, "Escape!/assets/images/teddybear.png"